{"auditStatus":"NOT_SAMPLED","authorizationMode":"RISK_BASED_AUTO_ELIGIBLE","candidateId":"scale500-tmdb-13761","editorialClosureStatus":"CLEARED","finalEditorialArtifactStatus":"VALID","governanceVersion":"v8-2-scalable-promotion-governance.v1","humanApproval":null,"humanReviewStatus":"NOT_REQUIRED","productionValidationStatus":"PASS","promotionDisposition":"ELIGIBLE","provenanceStatus":"COMPLETE","riskLayer":{"semanticResult":"LOW_RISK","sourceBoundarySatisfied":true,"unresolvedGroundingConflict":false},"riskRoutingStatus":"AUTO_ELIGIBLE","schemaVersion":"promotion-authorization.v2","sourceHashes":{"finalEditorialArtifact":"sha256:1853b4d583edb733e3d1748b98ce5b633b3f38ed637089a36a3b6d941551c448","governanceArtifact":"sha256:7d6a46d3fde76f4bd578fb17a168f5c87fa65c2fb2d25519fb5d88b72886a43e","productionRecord":"sha256:176aa285ea81975115a6d8d70392d97e27ca60ccf17e0a0eeb52930ff042e34a","promotionCandidate":"sha256:41b0ac6947017bb4cee1913362a45da9ee59042123a1c5809d9e24865791288c","riskLayerArtifact":"sha256:f7a8470782682c8d1a7351989101f4d0fd73838bb8275d985b0b94400b0e1694"},"structuralValidationStatus":"PASS","tmdbId":13761,"trancheGate":{"pauseCurrentTranche":false,"severeAuditMissCount":0},"validationStatus":"PASS"}
