{"auditStatus":"NOT_SAMPLED","authorizationMode":"RISK_BASED_AUTO_ELIGIBLE","candidateId":"scale500-tmdb-219","editorialClosureStatus":"CLEARED","finalEditorialArtifactStatus":"VALID","governanceVersion":"v8-2-scalable-promotion-governance.v1","humanApproval":null,"humanReviewStatus":"NOT_REQUIRED","productionValidationStatus":"PASS","promotionDisposition":"ELIGIBLE","provenanceStatus":"COMPLETE","riskLayer":{"semanticResult":"LOW_RISK","sourceBoundarySatisfied":true,"unresolvedGroundingConflict":false},"riskRoutingStatus":"AUTO_ELIGIBLE","schemaVersion":"promotion-authorization.v2","sourceHashes":{"finalEditorialArtifact":"sha256:c17c82cd0a9b4487f9dac7e03e74a733ee047c8160a9fd9af92e6a73d1894591","governanceArtifact":"sha256:7d6a46d3fde76f4bd578fb17a168f5c87fa65c2fb2d25519fb5d88b72886a43e","productionRecord":"sha256:121d923e4262c7875d8875ef17c631e7fb50845323d7b0e4eee663584d006932","promotionCandidate":"sha256:2b8613d203b79b8682304fcea3d3bc22c57d6cdd214f438f3aee36b274d481e4","riskLayerArtifact":"sha256:82f0b1f19175c1a776bfa0cfc222ba031c375e5ac729e84206123f5e802ee98b"},"structuralValidationStatus":"PASS","tmdbId":219,"trancheGate":{"pauseCurrentTranche":false,"severeAuditMissCount":0},"validationStatus":"PASS"}
