{"auditStatus":"NOT_SAMPLED","authorizationMode":"RISK_BASED_AUTO_ELIGIBLE","candidateId":"exp100-tmdb-26320","editorialClosureStatus":"CLEARED","finalEditorialArtifactStatus":"VALID","governanceVersion":"v8-2-scalable-promotion-governance.v1","humanApproval":null,"humanReviewStatus":"NOT_REQUIRED","productionValidationStatus":"PASS","promotionDisposition":"ELIGIBLE","provenanceStatus":"COMPLETE","riskLayer":{"semanticResult":"LOW_RISK","sourceBoundarySatisfied":true,"unresolvedGroundingConflict":false},"riskRoutingStatus":"AUTO_ELIGIBLE","schemaVersion":"promotion-authorization.v2","sourceHashes":{"finalEditorialArtifact":"sha256:e9c879299e007da069969ad62f771ca785cb797ef417105d633f4170cb84a031","governanceArtifact":"sha256:7d6a46d3fde76f4bd578fb17a168f5c87fa65c2fb2d25519fb5d88b72886a43e","productionRecord":"sha256:04ad9cd13aa667f33297ce2db4f389de6870b5e1046672cce81a75564b74f975","promotionCandidate":"sha256:335dd869cb57b66b0b5eb90f5ae410b6b2c054e6ae948ddcef36a6200c1400eb","riskLayerArtifact":"sha256:594f2efd6d5d84b20cf51e862c5a31be8f75f772b4c01bb98e3095a1577a02ad"},"structuralValidationStatus":"PASS","tmdbId":26320,"trancheGate":{"pauseCurrentTranche":false,"severeAuditMissCount":0},"validationStatus":"PASS"}
